{"id":"level-99","name":"Stress","grid":{"cols":9,"rows":12},"launcher":{"x":0.5},"shots":10,"startBalls":3,"blocks":[
{"type":"standard","col":0,"row":1,"hp":15}, {"type":"indestructible","col":1,"row":1}, {"type":"standard","col":2,"row":1,"hp":15}, {"type":"reinforced","col":3,"row":1,"hp":80}, {"type":"reinforced","col":5,"row":1,"hp":80}, {"type":"standard","col":6,"row":1,"hp":15},
{"type":"indestructible","col":7,"row":1}, {"type":"standard","col":8,"row":1,"hp":15}, {"type":"standard","col":0,"row":2,"hp":15}, {"type":"indestructible","col":1,"row":2}, {"type":"standard","col":2,"row":2,"hp":15}, {"type":"reinforced","col":3,"row":2,"hp":80},
{"type":"reinforced","col":5,"row":2,"hp":80}, {"type":"standard","col":6,"row":2,"hp":15}, {"type":"indestructible","col":7,"row":2}, {"type":"standard","col":8,"row":2,"hp":15}, {"type":"standard","col":0,"row":3,"hp":15}, {"type":"indestructible","col":1,"row":3},
{"type":"standard","col":2,"row":3,"hp":15}, {"type":"reinforced","col":3,"row":3,"hp":80}, {"type":"reinforced","col":5,"row":3,"hp":80}, {"type":"standard","col":6,"row":3,"hp":15}, {"type":"indestructible","col":7,"row":3}, {"type":"standard","col":8,"row":3,"hp":15},
{"type":"standard","col":0,"row":4,"hp":15}, {"type":"indestructible","col":1,"row":4}, {"type":"standard","col":2,"row":4,"hp":15}, {"type":"reinforced","col":3,"row":4,"hp":80}, {"type":"reinforced","col":5,"row":4,"hp":80}, {"type":"standard","col":6,"row":4,"hp":15},
{"type":"indestructible","col":7,"row":4}, {"type":"standard","col":8,"row":4,"hp":15}, {"type":"standard","col":0,"row":5,"hp":15}, {"type":"indestructible","col":1,"row":5}, {"type":"standard","col":2,"row":5,"hp":15}, {"type":"reinforced","col":3,"row":5,"hp":80},
{"type":"reinforced","col":5,"row":5,"hp":80}, {"type":"standard","col":6,"row":5,"hp":15}, {"type":"indestructible","col":7,"row":5}, {"type":"standard","col":8,"row":5,"hp":15}, {"type":"standard","col":0,"row":6,"hp":15}, {"type":"indestructible","col":1,"row":6},
{"type":"standard","col":2,"row":6,"hp":15}, {"type":"reinforced","col":3,"row":6,"hp":80}, {"type":"reinforced","col":5,"row":6,"hp":80}, {"type":"standard","col":6,"row":6,"hp":15}, {"type":"indestructible","col":7,"row":6}, {"type":"standard","col":8,"row":6,"hp":15},
{"type":"standard","col":0,"row":7,"hp":15}, {"type":"indestructible","col":1,"row":7}, {"type":"standard","col":2,"row":7,"hp":15}, {"type":"reinforced","col":3,"row":7,"hp":80}, {"type":"reinforced","col":5,"row":7,"hp":80}, {"type":"standard","col":6,"row":7,"hp":15},
{"type":"indestructible","col":7,"row":7}, {"type":"standard","col":8,"row":7,"hp":15}, {"type":"standard","col":0,"row":8,"hp":15}, {"type":"indestructible","col":1,"row":8}, {"type":"standard","col":2,"row":8,"hp":15}, {"type":"reinforced","col":3,"row":8,"hp":80},
{"type":"reinforced","col":5,"row":8,"hp":80}, {"type":"standard","col":6,"row":8,"hp":15}, {"type":"indestructible","col":7,"row":8}, {"type":"standard","col":8,"row":8,"hp":15}, {"type":"reinforced","col":3,"row":0,"hp":80}, {"type":"reinforced","col":5,"row":0,"hp":80},
{"type":"core","col":4,"row":0,"hp":500}
]}
