{
  "id": "level-01",
  "name": "Direct Shot",
  "grid": { "cols": 9, "rows": 12 },
  "launcher": { "x": 0.5 },
  "shots": 10,
  "startBalls": 3,
  "blocks": [
    { "type": "indestructible", "col": 2, "row": 0 },
    { "type": "indestructible", "col": 2, "row": 1 },
    { "type": "indestructible", "col": 2, "row": 2 },
    { "type": "indestructible", "col": 6, "row": 0 },
    { "type": "indestructible", "col": 6, "row": 1 },
    { "type": "indestructible", "col": 6, "row": 2 },
    { "type": "indestructible", "col": 4, "row": 2 },
    { "type": "indestructible", "col": 5, "row": 2 },
    { "type": "core", "col": 4, "row": 1, "hp": 100 },
    { "type": "indestructible", "col": 3, "row": 7 },
    { "type": "indestructible", "col": 4, "row": 7 },
    { "type": "standard", "col": 0, "row": 5, "hp": 2 },
    { "type": "standard", "col": 1, "row": 5, "hp": 4 },
    { "type": "standard", "col": 7, "row": 5, "hp": 4 },
    { "type": "standard", "col": 8, "row": 5, "hp": 2 },
    { "type": "standard", "col": 7, "row": 9, "hp": 6 },
    { "type": "standard", "col": 8, "row": 9, "hp": 10 },
    { "type": "standard", "col": 6, "row": 4, "hp": 8 },
    { "type": "multiplier", "col": 1, "row": 8, "value": 1 }
  ]
}
