{
  "id": "level-06",
  "name": "Twin Traps",
  "grid": { "cols": 9, "rows": 12 },
  "launcher": { "x": 0.5 },
  "shots": 15,
  "startBalls": 6,
  "blocks": [
    { "type": "indestructible", "col": 2, "row": 0 },
    { "type": "indestructible", "col": 6, "row": 0 },
    { "type": "core", "col": 1, "row": 1, "hp": 250 },
    { "type": "indestructible", "col": 2, "row": 1 },
    { "type": "indestructible", "col": 6, "row": 1 },
    { "type": "core", "col": 7, "row": 1, "hp": 250 },
    { "type": "indestructible", "col": 0, "row": 2 },
    { "type": "indestructible", "col": 8, "row": 2 },
    { "type": "indestructible", "col": 6, "row": 4 },
    { "type": "indestructible", "col": 3, "row": 5 },
    { "type": "multiplier", "col": 1, "row": 6, "value": 3 },
    { "type": "indestructible", "col": 5, "row": 6 },
    { "type": "multiplier", "col": 7, "row": 6, "value": 3 },
    { "type": "indestructible", "col": 2, "row": 7 },
    { "type": "indestructible", "col": 6, "row": 8 },
    { "type": "standard", "col": 4, "row": 10, "hp": 5 }
  ]
}
